<?xml version = "1.0" encoding = "utf-8"?>
<!DOCTYPE salanb-mapping SYSTEM
        "http://johnsalguero.com/dtd/salanb-mapping-0.1.dtd">
<salanb-mapping>
    <class name="com.salanb.webapp.models.Customer" table="Customers">
        <id name="id" column="Customer_Id" type="integer">
            <generator class="NATURAL"/>
        </id>
        <property name="username" type="string" column="Username"/>
        <property name="password" type="string" column="Password"/>
    </class>
    <class name="com.salanb.webapp.models.Product" table="Product">
        <id name="id" type="integer" column="Product_Id">
            <generator class="NATURAL"/>
        </id>
        <property name="name" type="string" column="Name"/>
        <property name="price" type="big_decimal" column="Price"/>
        <property name="isAvailable" type="boolean" column="Available"/>
        <property name="description" type="string" column="Description"/>
    </class>
    <class name="com.salanb.webapp.models.Transaction" table = "Transaction">
        <id name="id" column="Transaction_Id" type="integer">
            <generator class="NATURAL"/>
        </id>
        <property name = "customerId" column="Customer_Id" type ="integer"/>
        <property name="date" type="long" column="Date"/>
        <property name="subtotal" type="big_decimal" column="Subtotal"/>
    </class>
    <class name="com.salanb.webapp.models.Cart" table="Cart">
        <id name="productId" column="Product_Id" type="integer">
            <generator class="DEFINED"/>
        </id>
        <id name = "customerId" column="Customer_Id" type ="integer">
            <generator class = "DEFINED"/>
        </id>
        <property name="amount" column="Amount" type="integer"/>
    </class>
    <class name="com.salanb.webapp.models.TransactionProduct" table="ProductTransaction">
        <id name="productId" column="Product_Id" type="integer">
            <generator class="DEFINED"/>
        </id>
        <id name = "transactionId" column="Transaction_Id" type ="integer">
            <generator class = "DEFINED"/>
        </id>
        <property name="amount" type="integer" column="Amount"/>
    </class>
</salanb-mapping>