<?xml version = "1.0" encoding = "utf-8"?>
<!DOCTYPE salanb-mapping SYSTEM
        "http://johnsalguero.com/dtd/salanb-mapping-0.1.dtd">
<salanb-mapping>
    <class name = "com.salanb.webapp.models.Movie" table = "movies">

        <meta attribute = "class-description">
            This class contains the movie detail.
        </meta>

        <id name = "id" type = "integer" column = "m_id">
            <generator class="NATURAL"/>
        </id>

        <property name = "title" column = "title" type = "string"/>
        <property name = "price" column = "price" type = "big_decimal"/>
        <property name = "available" column = "available" type = "boolean"/>
        <property name = "returnDate" column = "return_date" type = "long"/>
        <property name = "directorId" column = "director_id" type = "integer"/>
        <property name = "genre_id" column = "genre_id" type = "integer"/>

    </class>
    <class name = "com.salanb.webapp.models.UserContent" table = "User_Data">

        <meta attribute = "class-description">
            This class contains the user details.
        </meta>

        <id name = "username" type = "string" column = "Username">
            <generator class="DEFINED"/>
        </id>

        <property name = "firstName" column = "First_Name" type = "string"/>
        <property name = "lastName" column = "Last_Name" type = "string"/>
        <property name = "phoneNumber" column = "Phone_Number" type = "string"/>
        <property name = "emailAddress" column = "Email" type = "string"/>
        <property name = "address" column = "Address_Line_1" type = "string"/>
        <property name = "city" column = "Address_Line_2" type = "string"/>
        <property name = "state" column = "State" type = "string"/>
        <property name = "zipCode" column = "Zip_Code" type = "string"/>
        <property name = "SSN_Hash" column = "SSN_Hash" type = "string"/>
        <property name = "Pass_Hash" column = "Pass_Hash" type = "string"/>

    </class>
</salanb-mapping>